1197,pub.1148322547,10.3390/su14116514,,,Logistics 5.0 Implementation Model Based on Decision Support Systems,"With the introduction of Society 5.0 for the sustainable future, special caution is given to humans’ role within the general system. Similarly, Industry 5.0 as a concept has been presented, followed by Logistics 5.0 in its theoretical framework. The transition towards the new concept of Logistics 5.0 requires an accurate and optimal strategic plan definition for which, in this paper, an implementation model based on decision support systems will be developed. The output data from this model are the priority of Logistics 5.0 elements (from five groups—green warehousing, green transport, green packaging, infrastructure and organization, and human resources) for the optimal implementation, based on three goals (initial investment, return of investment time, implementation and exploitation complexity) that companies aim to achieve in the future. The model is based on the analytic hierarchy process, and data were collected from an expert group and analyzed with several statistical methods. The result is a model that provides an optimal strategy for the implementation of elements of Logistics 5.0. The implementation priority list of elements is very beneficial for the management of many companies from various types of industries.",,Sustainability,,,2022-05-26,2022,2022-05-26,,14,11,6514,All OA; Gold,Article,"Trstenjak, Maja; Opetuk, Tihomir; Đukić, Goran; Cajner, Hrvoje","Trstenjak, Maja (); Opetuk, Tihomir (); Đukić, Goran (); Cajner, Hrvoje ()",,"Trstenjak, Maja (); Opetuk, Tihomir (); Đukić, Goran (); Cajner, Hrvoje ()",0,0,,,https://www.mdpi.com/2071-1050/14/11/6514/pdf?version=1653616159,https://app.dimensions.ai/details/publication/pub.1148322547,"35 Commerce, Management, Tourism and Services; 3509 Transportation, Logistics and Supply Chains; 46 Information and Computing Sciences; 4609 Information Systems","9 Industry, Innovation and Infrastructure"
1195,pub.1145650300,10.3390/app12042053,,,Production Plant and Warehouse Automation with IoT and Industry 5.0,"The Internet of Things (IoT) has been implemented by multiple manufacturing companies into their production chain as this technology is the main source of digitalization in a production plant. It improves the data assembling, productivity of the operation, communication efficiency, and overall manufacturing performance. IoT is also serves to be a good means for improved and efficient warehouse automation. It makes the delivery of products more efficient by calculating the least routes and also reduces the time that is consumed during the management of inventory. The basic objective of Industry 4.0 is to lessen the participation of human operators and to emphasize the automation systems. However, this objective has changed in Industry 5.0, which aims to achieve the maximum benefits through the human–machine interaction by maintaining a balance. Industry 5.0 aims to strengthen the interaction between ever-increasing powerful machinery and the productive abilities of human beings. This paper introduces a detailed overview of IoT in enabling digital transformations and Industry 4.0. The authors have discussed the application of IoT in different industrial sectors, and how the concept of IIoT has evolved. In addition to this, the present paper highlights several research studies that enable the authors to elicit the major challenges, implementation analysis, and future scope of IIoT.",,Applied Sciences,,,2022-02-16,2022,2022-02-16,,12,4,2053,All OA; Gold,Article,"Fatima, Zainab; Tanveer, Muhammad Hassan; Waseemullah; Zardari, Shehnila; Naz, Laviza Falak; Khadim, Hina; Ahmed, Noorah; Tahir, Midha","Fatima, Zainab (); Tanveer, Muhammad Hassan (); Waseemullah (); Zardari, Shehnila (); Naz, Laviza Falak (); Khadim, Hina (); Ahmed, Noorah (); Tahir, Midha ()",,"Fatima, Zainab (); Tanveer, Muhammad Hassan (); Waseemullah (); Zardari, Shehnila (); Naz, Laviza Falak (); Khadim, Hina (); Ahmed, Noorah (); Tahir, Midha ()",8,8,,,https://www.mdpi.com/2076-3417/12/4/2053/pdf?version=1645500032,https://app.dimensions.ai/details/publication/pub.1145650300,40 Engineering; 4014 Manufacturing Engineering,"9 Industry, Innovation and Infrastructure"
1195,pub.1120313005,10.3390/su11164371,,,Industry 5.0—A Human-Centric Solution,"Staying at the top is getting tougher and more challenging due to the fast-growing and changing digital technologies and AI-based solutions. The world of technology, mass customization, and advanced manufacturing is experiencing a rapid transformation. Robots are becoming even more important as they can now be coupled with the human mind by means of brain–machine interface and advances in artificial intelligence. A strong necessity to increase productivity while not removing human workers from the manufacturing industry is imposing punishing challenges on the global economy. To counter these challenges, this article introduces the concept of Industry 5.0, where robots are intertwined with the human brain and work as collaborator instead of competitor. This article also outlines a number of key features and concerns that every manufacturer may have about Industry 5.0. In addition, it presents several developments achieved by researchers for use in Industry 5.0 applications and environments. Finally, the impact of Industry 5.0 on the manufacturing industry and overall economy is discussed from an economic and productivity point of view, where it is argued that Industry 5.0 will create more jobs than it will take away.",,Sustainability,,,2019-08-13,2019,2019-08-13,,11,16,4371,All OA; Gold,Article,"Nahavandi, Saeid","Nahavandi, Saeid ()",,"Nahavandi, Saeid ()",237,204,,82.39,https://www.mdpi.com/2071-1050/11/16/4371/pdf,https://app.dimensions.ai/details/publication/pub.1120313005,40 Engineering; 4014 Manufacturing Engineering,"8 Decent Work and Economic Growth; 9 Industry, Innovation and Infrastructure"
1191,pub.1151795003,10.1109/comsci55378.2022.9912585,,,Methodology for Teaching Supply Chain Management Systems in the Training of Entrepreneurs,"The development of modern industrial production, based on the principles of Industry 4.0 and Industry 5.0, inevitably implies the introduction of a complete digitization of information flows used for business management. The implementation and use of information technology by business organizations is the basis of their competitiveness and development opportunity, especially when it comes to optimizing supply chain management (SCM) processes. In this respect, it is necessary to improve the skills and competencies of entrepreneurs from different sectors, the main role being played by training for effective use of Supply Chain Management Systems (SCMS). Finally, each training should end with an evaluation and analysis of the information received from the feedback received from learners and trainers. This paper focuses on the process of conducting SCMS training for entrepreneurs and management staff, as well as the derivation of indicators to assess the effectiveness and efficiency of training. A general sequence of training is indicated.",The authors would like to thank the Research and Development Sector at the Technical University of Sofia for the financial support.,,2022 10th International Scientific Conference on Computer Science (COMSCI),,2022-06-02,2022,,2022-06-02,00,,1-4,Closed,Proceeding,"Anguelov, Kiril; Kostev, Radoslav","Anguelov, Kiril (Management and Business Information Systems Department, Technical University of Sofia, Sofia, Bulgaria); Kostev, Radoslav (Management and Business Information Systems Department, Technical University of Sofia, Sofia, Bulgaria)","Anguelov, Kiril (Technical University of Sofia)","Anguelov, Kiril (Technical University of Sofia); Kostev, Radoslav (Technical University of Sofia)",0,0,,,,https://app.dimensions.ai/details/publication/pub.1151795003,"35 Commerce, Management, Tourism and Services; 3509 Transportation, Logistics and Supply Chains; 46 Information and Computing Sciences; 4609 Information Systems","9 Industry, Innovation and Infrastructure"
1190,pub.1142573884,10.1111/drev.12275,,,Industry 5.0—Are Designers Leading the Way?,"The aim of Industry 5.0 is to build upon the technology developed during the Industry 4.0 period and yield its benefits back to society. Industry 5.0 will bring the human touch back to manufacturing, business, and society. Designers have a great opportunity to lead the way.",,Design Management Review,,,2021-11-15,2021,2021-11-15,2021-12,32,4,12-17,Closed,Article,"Hirica, Andreea","Hirica, Andreea ()",,"Hirica, Andreea ()",0,0,,,,https://app.dimensions.ai/details/publication/pub.1142573884,40 Engineering; 4014 Manufacturing Engineering,"9 Industry, Innovation and Infrastructure"
1185,pub.1148148057,10.3389/fbuil.2022.871958,,,Greening Construction Transport as a Sustainability Enabler for New Zealand: A Research Framework,"The construction industry’s inherent fragmentation fuels Construction Supply Chain (CSC) complexity. Logistics form an essential part of the CSC in terms of costs and project management. In turn, transportation accounts for more than half the logistics costs due to construction materials being low-cost/high-volume, and most other logistics processes being business processes and not physical ones. Construction transport is almost entirely road bound, one of the least sustainable modes with externalities far out of proportion to its numbers. Ergo, its optimisation presents substantial greening (de-carbonisation) opportunity, with potentially far-reaching sustainability impacts. The ASI (Avoid-Shift-Improve) concept considers activity, modal structure, and energy intensity/efficiency as transport carbon components, providing a fundamental optimisation framework. 93% of New Zealand’s freight (a third of it construction related) is road bound, with 99% fossil-fuel (diesel) dependence. Government adoption of ASI elements viz Supply Chain (SC) efficiency, transport optimisation, data/information sharing, and collaboration for transport decarbonisation aligns with Industry 5.0, but seeks further research for concrete implementation pathways. This paper aims to bridge the gap by proposing a research framework for greening of construction transport as a sustainability enabler for New Zealand.",,Frontiers in Built Environment,,,2022-05-25,2022,2022-05-25,,8,,871958,All OA; Gold,Article,"Dhawan, Kamal; Tookey, John E.; GhaffarianHoseini, Ali; GhaffarianHoseini, Amirhosein","Dhawan, Kamal (School of Future Environments, Auckland University of Technology, Auckland, New Zealand); Tookey, John E. (School of Future Environments, Auckland University of Technology, Auckland, New Zealand); GhaffarianHoseini, Ali (School of Future Environments, Auckland University of Technology, Auckland, New Zealand); GhaffarianHoseini, Amirhosein (School of Future Environments, Auckland University of Technology, Auckland, New Zealand)","Dhawan, Kamal (Auckland University of Technology)","Dhawan, Kamal (Auckland University of Technology); Tookey, John E. (Auckland University of Technology); GhaffarianHoseini, Ali (Auckland University of Technology); GhaffarianHoseini, Amirhosein (Auckland University of Technology)",0,0,,,https://www.frontiersin.org/articles/10.3389/fbuil.2022.871958/pdf,https://app.dimensions.ai/details/publication/pub.1148148057,33 Built Environment and Design; 3302 Building; 40 Engineering; 4005 Civil Engineering,12 Responsible Consumption and Production
1184,pub.1144321680,10.1007/978-981-16-7365-8_11,,,Trends for Manufacturing Industry: A Strategic Roadmap Toward Industry 5.0,"Innovation has led to the rapid development of the manufacturing industry. The future directions of the manufacturing industry will highlight new competencies that employees will have to have and requirements that companies will have to have. The evaluation of these directions and the proposal of some organizational strategies represent necessary elements for the industry, experts and those who want to get started in the production activity. This chapter evaluates the implications of Industry 4.0 and makes an inventory of the technologies used in this industrial era. To consolidate the importance of this revolution for the manufacturing industry, a presentation of the situation in Romania is made from the perspective of various important indicators for Industry 4.0. At the end of the chapter is presented a market research and the strategic roadmap for the future of manufacturing. The case study highlights the fact that companies have a major interest in automation and digitization, but there are also several barriers that must be overcome. These barriers can be overcome with the help of facilitators that are presented at the end of the chapter.",,Advances in Sustainability Science and Technology,Sustainability and Innovation in Manufacturing Enterprises,,2022-01-01,2022,2022-01-01,2022,,,275-292,Closed,Chapter,"Dragan, Florin; Ivascu, Larisa; Ardelean, Ben-Oni","Dragan, Florin (Politehnica University of Timisoara, Department of Automation and Applied Informatics, Faculty of Automation and Computers, Timisoara, Romania); Ivascu, Larisa (Politehnica University of Timisoara, Faculty of Management in Production and Transportation, Timisoara, Romania; Academy of Romanian Scientists, 3 Ilfov Street, 050044, Bucharest, Romania); Ardelean, Ben-Oni (University of Bucharest, Faculty of Baptist Theology, Bucharest, Romania)","Ardelean, Ben-Oni (University of Bucharest)","Dragan, Florin (Polytechnic University of Timişoara); Ivascu, Larisa (Polytechnic University of Timişoara; Academy of Romanian Scientists); Ardelean, Ben-Oni (University of Bucharest)",1,1,,,,https://app.dimensions.ai/details/publication/pub.1144321680,40 Engineering; 4014 Manufacturing Engineering,"9 Industry, Innovation and Infrastructure"
1171,pub.1117771963,10.17587/mau.20.387-397,,,Conceptual Model of a Digital Platform for Cyber-Physical Management of a Modern Enterprises. Part 2. Digital Services,"The paper proposes conceptual model of a digital platform for cyber-physical management of manufacturing enterprises in the upcoming era of Industry 5.0, characterized by the vision of any business, including industrial production or logistics, as a complex adaptive system built on fundamental principles of self-organization and evolution, as well as interaction of artificial intelligence systems and people. The first part discusses principles of building a digital platform that can support operation of an enterprise within Industry 5.0 as a digital ecosystem of smart services. This part of the paper proposes typing of vasic platform services, lists the minimum set of services of each type, and gives description of their functionality. It also substantiates the leading role of multi-agent systems as a basic software architecture and technology for developing applications of the digital eco-systems. The paper provides examples of digital platforms and ecosystems of smart services for management of cargo transportation of the Russian Railways on the principles of ""uberisation"", life cycle of complex technical products, as well as enterprises of the plant-growing industry. It is shown that results are applicable to modern industrial corporations and enterprises in industry and agriculture, logistics, design, consulting and service.",,"Мехатроника, автоматизация, управление",,,2019-07-04,2019,2019-07-04,,20,7,387-397,Closed,Article,"Gorodetsky, V. I.; Laryukhin, V. B.; Skobelev, P. O.","Gorodetsky, V. I. (Institute of Control Sciences, Russian Academy of Sciences); Laryukhin, V. B. (Samara State Technical University); Skobelev, P. O. (Institute for the Control of Complex Systems RAS; SEC ""Smart Solutions"")",,"Gorodetsky, V. I. (); Laryukhin, V. B. (Samara State Technical University); Skobelev, P. O. ()",6,5,,2.09,,https://app.dimensions.ai/details/publication/pub.1117771963,40 Engineering; 4014 Manufacturing Engineering,"9 Industry, Innovation and Infrastructure"
1158,pub.1152316450,10.1201/9781003319375-14,,,Industry 5.0 for sustainable manufacturing,,,,Surface Engineering,,2022-10-28,2022,2022-10-28,,,,243-255,Closed,Chapter,"Chourasia, Shubhangi; Pandey, Shailesh Mani; Gupta, Kalpana; Murtaza, Qasim; Walia, R. S.","Chourasia, Shubhangi (); Pandey, Shailesh Mani (); Gupta, Kalpana (); Murtaza, Qasim (); Walia, R. S. ()",,"Chourasia, Shubhangi (); Pandey, Shailesh Mani (); Gupta, Kalpana (); Murtaza, Qasim (); Walia, R. S. ()",0,0,,,,https://app.dimensions.ai/details/publication/pub.1152316450,,
1153,pub.1149732968,10.1109/isie51582.2022.9831527,,,A Graphical and Executable Model for Production Simulation in the Context of Industry 5.0,"Cyber-Physical Systems (CPS) that combine IoT (Internet of Things) and Cloud computation technologies are an emerging trend in Industry 5.0. Such systems could lead to a different manufacturing process closer to the current market needs. In addition, the factories can be more efficient, sustainable, and environmentally friendly. This work intends to explore a different approach to the manufacturing process, where there is no production planned behind and the shop floor is a provider of services for the products to be built. For that purpose, this paper proposes an executable model defining the interaction between the different actors and representing the digital counterpart of the CPS. We use a high-level graphical language to create the executable model that allows easy and flexible experimentation with different scenarios. Also, the model can be made as detailed as needed while providing a precise and readable simulation and a resulting detailed log amenable to further analysis.",,,2022 IEEE 31st International Symposium on Industrial Electronics (ISIE),,2022-06-03,2022,,2022-06-03,00,,233-238,Closed,Proceeding,"Fernandes, Nuno; Barros, João Paulo; Campos-Rebelo, Rogerio","Fernandes, Nuno (Polytechnic Institute of Beja, School of Technology and Management, Beja, Portugal); Barros, João Paulo (Polytechnic Institute of Beja, School of Technology and Management, Beja, Portugal; UNINOVA, Centre of Technology and Systems, Monte de Caparica, Portugal); Campos-Rebelo, Rogerio (Polytechnic Institute of Beja, School of Technology and Management, Beja, Portugal; UNINOVA, Centre of Technology and Systems, Monte de Caparica, Portugal; NOVA University Lisbon, NOVA School of Science and Technology, Monte de Caparica, Portugal)",,"Fernandes, Nuno (Instituto Politécnico de Beja); Barros, João Paulo (Instituto Politécnico de Beja; Uninova); Campos-Rebelo, Rogerio (Instituto Politécnico de Beja; Uninova; Universidade Nova de Lisboa)",0,0,,,,https://app.dimensions.ai/details/publication/pub.1149732968,40 Engineering; 4014 Manufacturing Engineering,"9 Industry, Innovation and Infrastructure"
1146,pub.1144321682,10.1007/978-981-16-7365-8_3,,,Smart Manufacturing Systems Management,"The influence of IT in the manufacturing systems became not only visible but also a necessity of operational management. The manufacturing systems evolution is presented using a comparison between the industrial revolutions and Maslow’ hierarchy of needs, up-to-date. However, the presented evolution used life quality indicators, to explain the need for continuous adaptation of the manufacturing systems to people, the end customer. The virtualization of the enterprise IT system process and the reference cloud architecture is also presented, in order to clearly estate the prerequisites for Industry 4.0, with a detailed map of the internal cloud processes. The study also presented the major software providers prediction, before and during the COVID pandemic time, which greatly impacted consumer behaviour. Furthermore, the changes of the customer behaviour, cumulated with the globalization limitation, and workforce polarization, affected businesses in terms of rethinking the supply chain, with the target on flexibility, prediction and resilience and the attitude regarding the employees. The conclusions section summarizes the key findings of the study and exposes the authors’ prediction for the short-time evolution of the manufacturing systems.",,Advances in Sustainability Science and Technology,Sustainability and Innovation in Manufacturing Enterprises,,2022-01-01,2022,2022-01-01,2022,,,65-87,Closed,Chapter,"Carutasu, George; Carutasu, Nicoleta Luminita","Carutasu, George (Romanian-American University, Faculty of Computer Science for Business Management, Bucharest, Romania); Carutasu, Nicoleta Luminita (University Politehnica of Bucharest, Faculty of Industrial Engineering and Robotics, Bucharest, Romania)","Carutasu, George (Romanian-American University)","Carutasu, George (Romanian-American University); Carutasu, Nicoleta Luminita (Polytechnic University of Bucharest)",0,0,,,,https://app.dimensions.ai/details/publication/pub.1144321682,40 Engineering; 4014 Manufacturing Engineering,"9 Industry, Innovation and Infrastructure"
1145,pub.1150022503,10.1016/j.spc.2022.08.003,,,Identifying industry 5.0 contributions to sustainable development: A strategy roadmap for delivering sustainability values,"Scholars believe that the newly introduced Industry 5.0 has the potential to move beyond the profit-centered productivity of Industry 4.0 and to promote sustainable development goals such as human-centricity, socio-environmental sustainability, and resilience. However, little has been done to understand how this ill-defined phenomenon may deliver its indented sustainability values despite these speculative promises. To address this knowledge gap, the present study developed a strategy roadmap that explains the mechanism by which Industry 5.0 delivers its intended sustainable development functions. The study first developed and introduced the Industry 5.0 reference model that describes the technical and functional properties of this phenomenon. The study further conducted a content-centric synthesis of the literature and identified the sustainable development functions of Industry 5.0. Next, the interpretive structural modeling (ISM) technique was employed to identify the sequential relationships among the functions and construct the Industry 5.0-enabled model of sustainable development. The ISM involved collecting the opinions of 11 Industry 5.0 experts through expert panel meetings. Results revealed that Industry 5.0 delivers sustainable development values through 16 functions. Circular intelligent products, employee technical assistance, intelligent automation, open sustainable innovation, renewable integration, and supply chain adaptability are examples of the functions identified. These functions are highly interrelated and should be developed in a specific order so that the synergies and complementarities among them would maximize the sustainable development value gains. The roadmap to Industry 5.0-driven sustainability developed in this study is expected to provide a better understanding of ways Industry 5.0 can contribute to sustainable development, explaining how the development of its functions should be managed to maximize their synergies and contribution to the intended sustainability values. The study also highlights important avenues for future research, emphasizing the potential enablers of Industry 5.0 development, such as Government 5.0 or Corporate Governance 5.0.",This research has been a part of a project that received funding from the European Union&#x27;s Horizon 2020 research and innovation programme under grant agreement No 810318.,Sustainable Production and Consumption,,,2022-09,2022,,2022-09,33,,716-737,All OA; Hybrid,Article,"Ghobakhloo, Morteza; Iranmanesh, Mohammad; Mubarak, Muhammad Faraz; Mubarik, Mobashar; Rejeb, Abderahman; Nilashi, Mehrbakhsh","Ghobakhloo, Morteza (School of Economics and Business, Kaunas University of Technology, Kaunas, Lithuania); Iranmanesh, Mohammad (School of Business and Law, Edith Cowan University, Joondalup, WA 6027, Australia); Mubarak, Muhammad Faraz (School of Economics and Business, Kaunas University of Technology, Kaunas, Lithuania); Mubarik, Mobashar (Faculty of Technology Management and Business, Universiti Tun Hussein Onn Malaysia, Malaysia); Rejeb, Abderahman (Department of Management and Law, Faculty of Economics, University of Rome Tor Vergata, Via Columbia, 2, Rome 00133, Italy); Nilashi, Mehrbakhsh (UCSI Graduate Business School, UCSI University, No. 1 Jalan Menara Gading, UCSI Heights, 56000 Cheras, Kuala Lumpur, Malaysia; Centre for Global Sustainability Studies (CGSS), Universiti Sains Malaysia, 11800, USM Penang, Malaysia)","Ghobakhloo, Morteza (Kaunas University of Technology)","Ghobakhloo, Morteza (Kaunas University of Technology); Iranmanesh, Mohammad (Edith Cowan University); Mubarak, Muhammad Faraz (Kaunas University of Technology); Mubarik, Mobashar (Tun Hussein Onn University of Malaysia); Rejeb, Abderahman (University of Rome Tor Vergata); Nilashi, Mehrbakhsh (UCSI University; Universiti Sains Malaysia)",1,1,,,https://doi.org/10.1016/j.spc.2022.08.003,https://app.dimensions.ai/details/publication/pub.1150022503,41 Environmental Sciences; 4104 Environmental Management; 44 Human Society; 4404 Development Studies,"12 Responsible Consumption and Production; 9 Industry, Innovation and Infrastructure"
