920,pub.1151489272,10.1016/j.inffus.2022.09.027,,,FusionFedBlock: Fusion of blockchain and federated learning to preserve privacy in industry 5.0,"Nowadays, Industries are experiencing rapid changes in the digital environment, referred to as Industry 5.0. The Internet of Things (IoT) and advanced technologies are essential in the industrial environment. Technological advancements can collect, transfer, and analyze vast amounts of data in the industry via promising technologies. Still, IoT has various issues when applied to industrial infrastructures, such as centralization, privacy preservation, latency, and security. This article proposes a scheme as FusionFedBlock: Fusion of Blockchain and Federated Learning to Preserve Privacy in Industry 5.0 to address the aforementioned issues. At the federated layer, the industry's departments (Production, Quality Control, Distribution) allow local learning updates with network automation and communicate to the global model, which miners verify in the Blockchain networks. Federated-Learning offers privacy preservation between various mentioned departments in industries. Decentralized secure storage is provided by the Distributed Hash Table (DHT) at the cloud layer. The validation outcomes of the proposed scheme demonstrate excellent performance as the accuracy of 93.5% in a 50% active node for Industry 5.0 compared to existing frameworks.",This work was supported by the National Research Foundation of Korea (NRF) grant funded by the Korea government (MSIT) (No. 2022R1F1A1071926).,Information Fusion,,,2023-02,2023,,2023-02,90,,233-240,Closed,Article,"Singh, Sushil Kumar; Yang, Laurence T.; Park, Jong Hyuk","Singh, Sushil Kumar (Department of Computer Science and Engineering, Seoul National University of Science and Technology, (SeoulTech) Seoul 01811, Korea); Yang, Laurence T. (Department of Mathematics, Statistics and Computer Science, St. Francis Xavier University, Antigonish, NS, Canada); Park, Jong Hyuk (Department of Computer Science and Engineering, Seoul National University of Science and Technology, (SeoulTech) Seoul 01811, Korea)","Park, Jong Hyuk (Seoul National University of Science and Technology)","Singh, Sushil Kumar (Seoul National University of Science and Technology); Yang, Laurence T. (St. Francis Xavier University); Park, Jong Hyuk (Seoul National University of Science and Technology)",0,0,,,,https://app.dimensions.ai/details/publication/pub.1151489272,46 Information and Computing Sciences; 4604 Cybersecurity and Privacy; 4606 Distributed Computing and Systems Software,"9 Industry, Innovation and Infrastructure"
908,pub.1147798062,10.1142/s2424862222500129,,,Industry 4.0 and Its Suitability in Post COVID-19,"In the present era of technological advancement and rapid change, mankind faces different kinds of challenges. The product lifecycle has been shortened dramatically, and the manufacturing industry is moving from mass production to the high personalization of mass products. This era is widely known as the fourth industrial revolution or Industry 4.0 (I4.0). It seems that soon it will be inevitable for every society. The paper briefly focuses on empirical insights into the impact of I4.0 on various sectors of society. The traditional approaches to manufacturing, servicing, and public policy planning will no longer remain effective and would be transformed. I4.0 should be observed as an Opportunity 4.0 and draw attention to the industry, academia, and policymakers’ in changing scenarios. Expectations from them are also underlined. Its favorable features in the post-COVID-19 era are also discussed. This short article invites attention to foresee beyond I4.0, e.g. Industry 5.0 and more such progressions.",,Journal of Industrial Integration and Management,,,2022-06-15,2022,2022-06-15,,,,2250012,Closed,Article,"Kumar, Shailendra; Suhaib, Mohd.; Asjad, Mohammad; Salah, Bashir","Kumar, Shailendra (Mechanical Engineering Department, Faculty of Engineering and Technology, Jamia Millia Islamia, New Delhi, 110025, India; Mechanical Engineering Department, BBS College of Engineering and Technology, Prayagraj (UP) 211013, India); Suhaib, Mohd. (Mechanical Engineering Department, Faculty of Engineering and Technology, Jamia Millia Islamia, New Delhi, 110025, India); Asjad, Mohammad (Mechanical Engineering Department, Faculty of Engineering and Technology, Jamia Millia Islamia, New Delhi, 110025, India); Salah, Bashir (Department of Industrial Engineering, College of Engineering, King Saud University, PO Box 11421, Riyadh, Saudi Arabia)",,"Kumar, Shailendra (Jamia Millia Islamia; Biju Patnaik University of Technology); Suhaib, Mohd. (Jamia Millia Islamia); Asjad, Mohammad (Jamia Millia Islamia); Salah, Bashir (King Saud University)",1,1,,,,https://app.dimensions.ai/details/publication/pub.1147798062,40 Engineering; 4014 Manufacturing Engineering,"9 Industry, Innovation and Infrastructure"
907,pub.1143314852,10.1016/j.procir.2021.11.183,,,Towards The Resilient Operator 5.0: The Future of Work in Smart Resilient Manufacturing Systems,"Most recently, the COVID-19 pandemic has shown industries all around the world that their current manufacturing systems are not as resilient as expected and therefore many are failing. The workforce is the most agile and flexible manufacturing resource and simultaneously the most fragile one due to its humanity. By making human operators more resilient against a range of factors affecting their work and workplaces, enterprises can make their manufacturing systems more resilient. This paper introduces “The Resilient Operator 5.0” concept, based on human operator resilience and human-machine systems’ resilience, providing a vision for the future of work in smart resilient manufacturing systems in the emerging Industry 5.0 hallmark. It suggests how to achieve appropriate smart manufacturing systems’ resilience from a human-centric perspective through the means of the Operator 4.0 typology and its related technical solutions.",,Procedia CIRP,,,2021,2021,,2021,104,,1089-1094,All OA; Gold,Article,"Romero, David; Stahre, Johan","Romero, David (Department of Industrial Engineering, Tecnológico de Monterrey, 14380 Mexico City, Mexico); Stahre, Johan (Division of Production Systems, Chalmers University of Technology, 41296 Göteborg, Sweden)",,"Romero, David (Monterrey Institute of Technology and Higher Education); Stahre, Johan (Chalmers University of Technology)",21,21,,,https://doi.org/10.1016/j.procir.2021.11.183,https://app.dimensions.ai/details/publication/pub.1143314852,40 Engineering; 4014 Manufacturing Engineering,"11 Sustainable Cities and Communities; 9 Industry, Innovation and Infrastructure"
904,pub.1131096288,10.20627/jsim.38.1_62,,,Panel Discussion Industry 4.0 in East Asia,"Each panelist briefly introduces the initiative, the status quo, and the perspective on Industry 4.0 in their homeland. The panelists represent Made in China 2025 in mainland China, Productivity 4.0 in Taiwan, Manufacturing Innovation 3.0 Initiative in South Korea, Industry 4.0 in Vietnam, and Society 5.0 in Japan and summarize these initiatives. Then, the panelists and participants have discussions on the matters.",,日本情報経営学会誌,,,2020-09,2020,,,38,1,62-71,Closed,Article,"TAKAKUWA, Soemon; Ershi, QI; CHOU, Shuo-Yan; MOON, Hee-Cheol; NGUYEN, Dang Minh; Run, ZHAO","TAKAKUWA, Soemon (Chuo University); Ershi, QI (Tianjin University); CHOU, Shuo-Yan (National Taiwan University of Science and Technology); MOON, Hee-Cheol (Chungnam National University); NGUYEN, Dang Minh (Vietnam National University); Run, ZHAO (JiangSu University of Science and Technology)",,"TAKAKUWA, Soemon (Chuo University); Ershi, QI (Tianjin University); CHOU, Shuo-Yan (National Taiwan University of Science and Technology); MOON, Hee-Cheol (Chungnam National University); NGUYEN, Dang Minh (); Run, ZHAO (Jiangsu University of Science and Technology)",0,0,,0.0,,https://app.dimensions.ai/details/publication/pub.1131096288,40 Engineering; 4014 Manufacturing Engineering,"9 Industry, Innovation and Infrastructure"
903,pub.1151303985,10.1007/978-3-031-15928-2_40,,,Enhancing Human-Robot Collaboration in the Industry 5.0 Context: Workplace Layout Prototyping,"According to the Industry 5.0 framework, the smart factory should combine digitalization and prediction activities with a greater sustainability and human centrality within working processes. Indeed, the optimization and improvement of the manufacturing processes have to meet cost criteria related to energy consumption, safety, and implementation of new technologies. The development of better and more advanced technologies boosts Human-Robot Interaction (HRI) in the manufacturing processes. However, due to the high number of safety standards about collaborative robotics and the absence of tools and specific design approaches, collaborative robots (cobots) are still widely adopted as traditional industrial robots wasting the huge potential of a properly Human-Robot Collaboration (HRC). The layout designing is a crucial activity in achieving a proper and effective HRC. This work illustrates how to transfer standard-compliant layout solutions towards an interactive three-dimensional (3D) visualization environment in order to enable the digital prototyping of HRC workplaces. The possibility to automatically generate and visualize multiple layout solutions of collaborative workplaces, and then, to simulate the interaction between human and robot, represents one of the most significant tasks during the designing process. HRC workplace layout is designed according to an optimization criterion, by using the full integration of a numerical computing platform with an interactive 3D visualization environment. Then, by means of the variation of the input parameters, the visualization of new layout solutions is enabled in a fast and effective way.","This study was developed with the economic support of MUR (Italian Ministry of Universities and Research) under the remit of project ARS01_00861, ‘Integrated collaborative systems for smart factory – ICOSAF”.",Lecture Notes in Mechanical Engineering,"Advances on Mechanics, Design Engineering and Manufacturing IV",,2022-09-25,2022,2022-09-25,2023,,,454-465,Closed,Chapter,"Di Marino, Castrese; Rega, Andrea; Vitolo, Ferdinando; Patalano, Stanislao","Di Marino, Castrese (Fraunhofer J-Lab IDEAS, Department of Industrial Engineering, University of Naples Federico II, Naples, Italy); Rega, Andrea (Fraunhofer J-Lab IDEAS, Department of Industrial Engineering, University of Naples Federico II, Naples, Italy); Vitolo, Ferdinando (Fraunhofer J-Lab IDEAS, Department of Industrial Engineering, University of Naples Federico II, Naples, Italy); Patalano, Stanislao (Fraunhofer J-Lab IDEAS, Department of Industrial Engineering, University of Naples Federico II, Naples, Italy)","Rega, Andrea (University of Naples Federico II)","Di Marino, Castrese (University of Naples Federico II); Rega, Andrea (University of Naples Federico II); Vitolo, Ferdinando (University of Naples Federico II); Patalano, Stanislao (University of Naples Federico II)",0,0,,,,https://app.dimensions.ai/details/publication/pub.1151303985,40 Engineering; 4014 Manufacturing Engineering; 46 Information and Computing Sciences; 4608 Human-Centred Computing,"9 Industry, Innovation and Infrastructure"
902,pub.1151631538,10.1007/978-3-031-08038-8_1,,,Green Mobile Cloud Computing forIndustry 5.0,"Industry 5.0 delivers a vision of the industry that intends efficiency and productivity goals. It reinforces the contribution of industry 5.0 to sustainable smart cities and societies. The exponential increase in mobile users and their demands towards computing and communication resources have raised several challenges: mobility, limited battery, latency, energy consumption, etc. Mobile cloud computing (MCC) offers the facilities to store the data and execute applications inside the cloud by offloading. Nevertheless, the decision-making regarding offloading for energy-efficiency and low latency is significant and it needs novel research contributions. Furthermore, security, privacy, resource allocation, etc. are other significant issues that seek novel solutions. Fog, Edge cloud computing reduced delay and was used for real-time IoT application offloading. MCC is an engine of prosperity; production needs digital and green modulations.",,,Green Mobile Cloud Computing,,2022-10-07,2022,2022-10-07,2022,,,3-20,Closed,Chapter,"Mukherjee, Anwesha; De, Debashis; Buyya, Rajkumar","Mukherjee, Anwesha (Department of Computer Science, Mahishadal Raj College, Mahishadal, Purba Medinipur, West Bengal, India); De, Debashis (Department of Computer Science and Engineering, Centre of Mobile Cloud Computing, Maulana Abul Kalam Azad University of Technology, West Bengal, Nadia, India); Buyya, Rajkumar (Cloud Computing and Distributed Systems (CLOUDS) Laboratory, School of Computing andInformation Systems, The University of Melbourne, Parkville, VIC, Australia)","Mukherjee, Anwesha (Vidyasagar University)","Mukherjee, Anwesha (Vidyasagar University); De, Debashis (West Bengal University of Technology); Buyya, Rajkumar (University of Melbourne)",0,0,,,,https://app.dimensions.ai/details/publication/pub.1151631538,46 Information and Computing Sciences; 4606 Distributed Computing and Systems Software,7 Affordable and Clean Energy
897,pub.1146140036,10.3390/automation3010008,,,Digital Twin of a Flexible Manufacturing System for Solutions Preparation,"In the last few decades, there has been a growing necessity for systems that handle market changes and personalized customer needs with near mass production efficiency, defined as the new mass customization paradigm. The Industry 5.0 vision further enhances the human-centricity aspect, in the necessity for manufacturing systems to cooperate with workers, taking advantage of their problem-solving capabilities, creativity, and expertise of the manufacturing process. A solution is to develop a flexible manufacturing system capable of handling different customer requests and real-time decisions from operators. This paper tackles these aspects by proposing a digital twin of a robotic system for solution preparation capable of making real-time scheduling decisions and forecasts using a simulation model while allowing human interventions. A discrete event simulation model was used to forecast possible system improvements. The simulation handles real-time scheduling considering the possibility of adding identical parallel machines. Results show that processing multiple jobs simultaneously with more than one machine on critical processes, increasing the robot speed, and using heuristics that emphasize the shortest transportation time can reduce the overall completion time by 82%. The simulation model has an animated visualization window for a deeper understanding of the system.",,Automation,,,2022-03-08,2022,2022-03-08,,3,1,153-175,All OA; Gold,Article,"Coito, Tiago; Faria, Paulo; Martins, Miguel S. E.; Firme, Bernardo; Vieira, Susana M.; Figueiredo, João; Sousa, João M. C.","Coito, Tiago (); Faria, Paulo (); Martins, Miguel S. E. (); Firme, Bernardo (); Vieira, Susana M. (); Figueiredo, João (); Sousa, João M. C. ()",,"Coito, Tiago (); Faria, Paulo (); Martins, Miguel S. E. (); Firme, Bernardo (); Vieira, Susana M. (); Figueiredo, João (); Sousa, João M. C. ()",3,3,,,https://www.mdpi.com/2673-4052/3/1/8/pdf?version=1647833868,https://app.dimensions.ai/details/publication/pub.1146140036,40 Engineering; 4014 Manufacturing Engineering,"9 Industry, Innovation and Infrastructure"
896,pub.1149026825,10.1007/s00170-022-09576-4,,,Robust RFID tag design for reliable communication within the Internet of Things,"Radio frequency identification (RFID) is a cost-effective method to support the Industrial Internet of Things (IIoT) and is an enabling technology for Industry 5.0. The use of RFID is particularly suited to IIoT as it does not require a line of sight for communication and can be retroactively affixed to non-smart items. However, RFID communication is affected by the properties of the material the tag is affixed to, specifically the material permittivity. Metal is commonly present in smart factory environments and supply chains and impedes RFID communication. A suitable tag design is required to accommodate these challenges and ensure resilience for Industry 5.0 applications. The research presented in this paper has assessed the communication performance of RFID antenna designs with and without metal present beneath the tag. The RFID tag designs that performed reliably in the simulation were manufactured, and their read range was tested on materials of varying relative permittivity and thickness to represent MP and NMP scenarios. The results have verified the robustness of “Cyber” to “Physical” designs and provide recommendations to support practitioner IIoT tag selection.",,The International Journal of Advanced Manufacturing Technology,,,2022-06-28,2022,2022-06-28,2022-07,121,5-6,3903-3917,All OA; Hybrid,Article,"Tribe, James; Hayward, Steven; van Lopik, Katherine; Whittow, William G.; West, Andrew A.","Tribe, James (The Wolfson School of Mechanical Electrical and Manufacturing Engineering, Loughborough University, Loughborough, Leicestershire, UK); Hayward, Steven (The Wolfson School of Mechanical Electrical and Manufacturing Engineering, Loughborough University, Loughborough, Leicestershire, UK); van Lopik, Katherine (The Wolfson School of Mechanical Electrical and Manufacturing Engineering, Loughborough University, Loughborough, Leicestershire, UK); Whittow, William G. (The Wolfson School of Mechanical Electrical and Manufacturing Engineering, Loughborough University, Loughborough, Leicestershire, UK); West, Andrew A. (The Wolfson School of Mechanical Electrical and Manufacturing Engineering, Loughborough University, Loughborough, Leicestershire, UK)","Hayward, Steven (Loughborough University)","Tribe, James (Loughborough University); Hayward, Steven (Loughborough University); van Lopik, Katherine (Loughborough University); Whittow, William G. (Loughborough University); West, Andrew A. (Loughborough University)",1,1,,,https://link.springer.com/content/pdf/10.1007/s00170-022-09576-4.pdf,https://app.dimensions.ai/details/publication/pub.1149026825,46 Information and Computing Sciences; 4606 Distributed Computing and Systems Software,"9 Industry, Innovation and Infrastructure"
896,pub.1147213026,10.1007/978-3-030-89546-4,,,Blockchain Applications in the Smart Era,"This book covers a variety of topics and trends related to blockchain technology for smart era applications. The applications span industries such as transportation, manufacturing, agriculture, finance, retail, logistics, information systems, all far beyond blockchain's original use in cyptocurrency. The authors present variants, new models, practical solutions, and technological advances related to blockchain in these fields and more. The applications within these fields include blockchain and cyber-security, IoT security and privacy using blockchain, security using blockchain for robots, and blockchain in industries 4.0 and society 5.0. A variety of case studies are also included. The book is applicable to researchers, professionals, students, and professors in a variety of fields in communications engineering. Presents challenges and trends in blockchain for applications in manufacturing, health, security, and government finance; Discusses the impact of blockchain on society and industry; Applicable to researchers, professionals, students, and professors in a variety of fields in communications engineering.",,EAI/Springer Innovations in Communication and Computing,,,2022,2022,,2022,,,,All OA; Green,Edited Book,,,,,0,0,,,https://link.springer.com/content/pdf/bfm%3A978-3-030-89546-4%2F1,https://app.dimensions.ai/details/publication/pub.1147213026,46 Information and Computing Sciences; 4604 Cybersecurity and Privacy,"9 Industry, Innovation and Infrastructure"
895,pub.1148184350,10.1016/j.procir.2022.05.042,,,An IIoT Platform For Human-Aware Factory Digital Twins,"In the context of the Industry 4.0 approach, applications and solutions supporting monitoring, simulation, optimisation and decision-making in production systems are exponentially growing. These solutions are commonly built on digital twins, i.e., comprehensive, structured and effective digital representations of the production system and its entities, whose current status is constantly updated by the plugged data sources. The arising of the Industry 5.0 paradigm and the established key role of workers in manufacturing require new Digital Twins to represent also humans. In fact, as cognitive automation becomes more and more pervasive and its behaviour unintelligible to humans, it becomes essential for improving performance and well-being, at the same time, to model humans as data-driven agents and to represent their interaction with the factory systems. Currently, a standardised solution for creating Digital Twins is missing, forcing industrial solution architects to resort to ad-hoc implementations and models. These solutions lack re-usability, scalability and extensibility, preventing the introduction of a human digital representation in existent twins, so hindering the complete shift to the new Industry 5.0 paradigm. In this paper, such limitations are faced by introducing an extensible and flexible IIoT-industrial internet of things-based platform with a twofold benefit: on the one hand, to support the creation of customised data representations of production systems and their entities including humans; on the other hand, to provide a modular infrastructure, along with its interchangeable components, for easy digital twin instantiation and ramp-up. An implementation of the platform has been tested with different applications in a laboratory setting and released as a public resource. Finally, potential future applications of the proposed digital twin are discussed, highlighting its main benefits.",,Procedia CIRP,,,2022,2022,,2022,107,,661-667,All OA; Gold,Article,"Montini, Elias; Cutrona, Vincenzo; Bonomi, Niko; Landolfi, Giuseppe; Bettoni, Andrea; Rocco, Paolo; Carpanzano, Emanuele","Montini, Elias (DTI-University of Applied Sciences and Arts of Southern Switzerland, Via la Santa 1, Lugano-Viganello, Switzerland, 6962; Politecnico di Milano, Dipartimento di Elettronica, Informazione e Bioingegneria, Piazza Leonardo da Vinci 32, 20133 Milano, Italy); Cutrona, Vincenzo (Politecnico di Milano, Dipartimento di Elettronica, Informazione e Bioingegneria, Piazza Leonardo da Vinci 32, 20133 Milano, Italy); Bonomi, Niko (Politecnico di Milano, Dipartimento di Elettronica, Informazione e Bioingegneria, Piazza Leonardo da Vinci 32, 20133 Milano, Italy); Landolfi, Giuseppe (DTI-University of Applied Sciences and Arts of Southern Switzerland, Via la Santa 1, Lugano-Viganello, Switzerland, 6962); Bettoni, Andrea (DTI-University of Applied Sciences and Arts of Southern Switzerland, Via la Santa 1, Lugano-Viganello, Switzerland, 6962); Rocco, Paolo (DTI-University of Applied Sciences and Arts of Southern Switzerland, Via la Santa 1, Lugano-Viganello, Switzerland, 6962); Carpanzano, Emanuele (DTI-University of Applied Sciences and Arts of Southern Switzerland, Via la Santa 1, Lugano-Viganello, Switzerland, 6962)",,"Montini, Elias (University of Applied Sciences and Arts of Southern Switzerland; Politecnico di Milano); Cutrona, Vincenzo (Politecnico di Milano); Bonomi, Niko (Politecnico di Milano); Landolfi, Giuseppe (University of Applied Sciences and Arts of Southern Switzerland); Bettoni, Andrea (University of Applied Sciences and Arts of Southern Switzerland); Rocco, Paolo (University of Applied Sciences and Arts of Southern Switzerland); Carpanzano, Emanuele (University of Applied Sciences and Arts of Southern Switzerland)",0,0,,,https://doi.org/10.1016/j.procir.2022.05.042,https://app.dimensions.ai/details/publication/pub.1148184350,40 Engineering; 4014 Manufacturing Engineering,"9 Industry, Innovation and Infrastructure"
